{
  "eventId": "019c3000-0000-7000-8000-000000000001",
  "eventType": "message.persisted.v1",
  "schemaVersion": 1,
  "occurredAt": "2026-08-18T01:10:00.000Z",
  "producer": "andruha-messages-dialogues-service",
  "correlationId": "019c3000-0000-7000-8000-000000000002",
  "causationId": "019c3000-0000-7000-8000-000000000003",
  "payload": {
    "targetUserId": "019c3000-0000-7000-8000-000000000004",
    "clientMessageId": "019c3000-0000-7000-8000-000000000005",
    "message": {
      "messageId": "019c3000-0000-7000-8000-000000000006",
      "dialogId": "019c3000-0000-7000-8000-000000000007",
      "senderId": "019c3000-0000-7000-8000-000000000004",
      "sentAt": "2026-08-18T01:10:00.000Z",
      "text": "Привет",
      "attachments": []
    }
  }
}
